{"id":"spire_01","name":"The Grey Spire — Summit","tileset":"greybox","width":20,"height":20,"layers":{"ground":[[5,3,5,3,5,3,5,3,5,3,5,3,5,3,5,3,5,3,5,3],[3,5,3,5,3,5,3,5,3,5,3,5,3,5,3,5,3,5,3,5],[5,3,5,3,5,3,5,3,5,3,5,3,5,3,5,3,5,3,5,3],[3,5,3,5,3,5,3,5,3,5,3,5,3,5,3,5,3,5,3,5],[5,3,5,3,5,3,5,3,5,3,5,3,5,3,5,3,5,3,5,3],[3,5,3,5,3,5,3,5,3,5,3,5,3,5,3,5,3,5,3,5],[5,3,5,3,5,3,5,3,5,3,5,3,5,3,5,3,5,3,5,3],[3,5,3,5,3,5,3,5,3,5,3,5,3,5,3,5,3,5,3,5],[5,3,5,3,5,3,5,3,5,3,5,3,5,3,5,3,5,3,5,3],[3,5,3,5,3,5,3,5,3,5,3,5,3,5,3,5,3,5,3,5],[5,3,5,3,5,3,5,3,5,3,5,3,5,3,5,3,5,3,5,3],[3,5,3,5,3,5,3,5,3,5,3,5,3,5,3,5,3,5,3,5],[5,3,5,3,5,3,5,3,5,3,5,3,5,3,5,3,5,3,5,3],[3,5,3,5,3,5,3,5,3,5,3,5,3,5,3,5,3,5,3,5],[5,3,5,3,5,3,5,3,5,3,5,3,5,3,5,3,5,3,5,3],[3,5,3,5,3,5,3,5,3,5,3,5,3,5,3,5,3,5,3,5],[5,3,5,3,5,3,5,3,5,3,5,3,5,3,5,3,5,3,5,3],[3,5,3,5,3,5,3,5,3,5,3,5,3,5,3,5,3,5,3,5],[5,3,5,3,5,3,5,3,5,3,5,3,5,3,5,3,5,3,5,3],[3,5,3,5,3,5,3,5,3,5,3,5,3,5,3,5,3,5,3,5]],"collision":[[1,1,1,1,1,1,1,1,1,1,1,1,1,1,1,1,1,1,1,1],[1,0,0,0,0,0,0,0,0,0,0,0,0,0,0,0,0,0,0,1],[1,0,0,0,0,0,0,0,0,0,0,0,0,0,0,0,0,0,0,1],[1,0,0,0,0,0,0,0,0,0,0,0,0,0,0,0,0,0,0,1],[1,0,0,0,0,0,0,0,0,0,0,0,0,0,0,0,0,0,0,1],[1,0,0,0,0,0,0,0,0,0,0,0,0,0,0,0,0,0,0,1],[1,0,0,0,0,0,0,0,0,0,0,0,0,0,0,0,0,0,0,1],[1,0,0,0,0,0,0,0,0,0,0,0,0,0,0,0,0,0,0,1],[1,0,0,0,0,0,0,0,0,0,0,0,0,0,0,0,0,0,0,1],[1,0,0,0,0,0,0,0,0,0,0,0,0,0,0,0,0,0,0,1],[1,0,0,0,0,0,0,0,0,0,0,0,0,0,0,0,0,0,0,1],[1,0,0,0,0,0,0,0,0,0,0,0,0,0,0,0,0,0,0,1],[1,0,0,0,0,0,0,0,0,0,0,0,0,0,0,0,0,0,0,1],[1,0,0,0,0,0,0,0,0,0,0,0,0,0,0,0,0,0,0,1],[1,0,0,0,0,0,0,0,0,0,0,0,0,0,0,0,0,0,0,1],[1,0,0,0,0,0,0,0,0,0,0,0,0,0,0,0,0,0,0,1],[1,0,0,0,0,0,0,0,0,0,0,0,0,0,0,0,0,0,0,1],[1,0,0,0,0,0,0,0,0,0,0,0,0,0,0,0,0,0,0,1],[1,0,0,0,0,0,0,0,0,0,0,0,0,0,0,0,0,0,0,1],[1,1,1,1,1,1,1,1,1,1,1,1,1,1,1,1,1,1,1,1]]},"objects":[{"type":"pillar","tx":4,"ty":4},{"type":"pillar","tx":15,"ty":4},{"type":"pillar","tx":4,"ty":15},{"type":"pillar","tx":15,"ty":15}],"entities":[{"type":"player_spawn","tx":10,"ty":16},{"type":"boss_warden","tx":10,"ty":8,"props":{"defeatFlags":["f_warden_down","f_spire_restored"]}}],"triggers":[{"shape":"rect","tx":9,"ty":18,"w":3,"h":1,"action":"goto","target":"greybox_02:20,3"}],"ambient":{"restoredFlag":"f_spire_restored"}}